{
  "$schema": "https://json-schema.org/draft/2020-12/schema",
  "$id": "https://kacyluker.com/astronomy/schema/notebook.schema.json",
  "title": "Notebook",
  "description": "One paper notebook, page by page, in scan order.",
  "type": "object",
  "additionalProperties": false,
  "required": ["id", "title", "pages"],
  "properties": {
    "id": {
      "description": "Unique slug; matches the file name without .json and the scans/<id>/ folder.",
      "type": "string",
      "pattern": "^[a-z0-9][a-z0-9-]*$"
    },
    "title": { "type": "string" },
    "owner": { "type": ["string", "null"] },
    "status": {
      "description": "Whether the notebook is still being written in.",
      "enum": ["in_progress", "completed"]
    },
    "started": { "type": ["string", "null"], "format": "date" },
    "finished": { "type": ["string", "null"], "format": "date" },
    "scan": {
      "description": "How scripts/split-notebook.mjs turns each scanned spread into two pages.",
      "type": "object",
      "additionalProperties": false,
      "properties": {
        "rotate": {
          "description": "Clockwise degrees that make the spread upright.",
          "enum": [0, 90, 180, 270]
        },
        "split": {
          "description": "Where the fold sits, as a fraction of the upright spread's width, for spreads whose fold can't be found.",
          "type": "number",
          "exclusiveMinimum": 0,
          "exclusiveMaximum": 1
        }
      }
    },
    "front_cover": {
      "description": "The outside front cover, scanned on its own to scans/<id>/cover-front.jpg. Absent until it's scanned.",
      "type": "object",
      "additionalProperties": false,
      "properties": {
        "open": {
          "description": "Waiting to be rescanned now that the notebook is complete.",
          "type": "boolean"
        }
      }
    },
    "pages": {
      "description": "Every scanned page in order (categories in the order of data/categories.json, session pages by number); the nth entry is scans/<id>/<nn>.jpg.",
      "type": "array",
      "items": { "$ref": "#/$defs/page" }
    }
  },
  "$defs": {
    "page": {
      "type": "object",
      "additionalProperties": false,
      "required": ["kind"],
      "properties": {
        "kind": {
          "description": "The page's category from data/categories.json (any but front_cover), or unused (a session page with only crossed-out entries) or blank.",
          "type": "string"
        },
        "number": {
          "description": "Page number: printed on odd pages, inferred for even ones. Front matter has none.",
          "type": ["integer", "null"],
          "minimum": 1
        },
        "label": {
          "description": "A name for the page; defaults to its category's label.",
          "type": ["string", "null"]
        },
        "note": { "type": ["string", "null"] },
        "open": {
          "description": "Still being written in, or waiting to be rescanned once the notebook is completed. Re-read on the next import; hidden on the site (except session pages).",
          "type": "boolean"
        },
        "redact": {
          "description": "Boxes to blur before publishing, as [x, y, width, height] fractions of the page.",
          "type": "array",
          "items": {
            "type": "array",
            "items": { "type": "number", "minimum": 0, "maximum": 1 },
            "minItems": 4,
            "maxItems": 4
          }
        }
      }
    }
  }
}
