{
  "id": "test-001",
  "title": "Test Notebook 1",
  "owner": "Test Observer",
  "status": "completed",
  "started": "2025-03-01",
  "finished": "2025-12-31",
  "scan": { "rotate": 90, "split": 0.47 },
  "front_cover": {},
  "pages": [
    { "kind": "inside_front_cover" },
    { "kind": "title", "redact": [[0.12, 0.62, 0.76, 0.12]] },
    { "kind": "contents" },
    { "kind": "contents" },
    { "kind": "reference", "label": "Seeing and transparency key" },
    { "kind": "session", "number": 1 },
    { "kind": "session", "number": 2 },
    { "kind": "session", "number": 3 },
    { "kind": "session", "number": 4 },
    { "kind": "unused", "number": 5, "note": "One entry, crossed out" },
    { "kind": "session", "number": 6 },
    { "kind": "session", "number": 7 },
    { "kind": "session", "number": 8 },
    { "kind": "session", "number": 9 },
    { "kind": "blank", "number": 10 },
    { "kind": "index" },
    { "kind": "index" },
    { "kind": "info" },
    { "kind": "inside_back_cover" }
  ]
}
